source_row_id,date,source_name,title,opening_text,hit_sentence,url,reach,clean_text,is_relevant,relevance_reason,reputation_driver,sub_driver,sentiment,classification_confidence,classification_reason,classification_source,matched_terms,dedupe_key
2,2026-01-17,BW BusinessWorld,ICICI Prudential Mutual Fund Launches Two Offerings Under The iSIF Segment,iSIF Equity Ex-Top 100 Long-Short Fund and iSIF Hybrid Long-Short Fund,"limit). Speaking at the launch, Sankaran Naren, ED & CIO, ICICI Prudential AMC, said: “Through the iSIF segment, we are offering",https://www.businessworld.in/article/icici-prudential-mutual-fund-launches-two-offerings-under-the-isif-segment-587707,1016871,"ICICI Prudential Mutual Fund Launches Two Offerings Under The iSIF Segment iSIF Equity Ex-Top 100 Long-Short Fund and iSIF Hybrid Long-Short Fund limit). Speaking at the launch, Sankaran Naren, ED & CIO, ICICI Prudential AMC, said: “Through the iSIF segment, we are offering",True,Brand mention includes a reputation-relevant BFSI context.,Brand Perception,Product Strategy,Neutral,0.95,"Matched taxonomy terms for Product Strategy: launch, launches, offering, offerings, segment.",rule,"launch, launches, offering, offerings, segment, isif",beb2c75a407a305b
3,2026-03-09,The Economic Times,Best Fund Managers 2025: Top wealth creators who mastered the balance between risk and returns,Indian equity fund managers navigated a challenging market by prioritising risk management and resilience. Many adopted conservative,"at Nippon India Asset Management Company (AMC) and ICICI Prudential AMC earlier, Gunwani has now put his stamp on equity",https://economictimes.indiatimes.com/wealth/invest/best-fund-managers-2025-top-wealth-creators-who-mastered-the-balance-between-risk-and-returns/articleshow/129193733.cms,,"Best Fund Managers 2025: Top wealth creators who mastered the balance between risk and returns Indian equity fund managers navigated a challenging market by prioritising risk management and resilience. Many adopted conservative at Nippon India Asset Management Company (AMC) and ICICI Prudential AMC earlier, Gunwani has now put his stamp on equity",True,Brand mention includes a reputation-relevant BFSI context.,User Experience,Product & Service Quality,Positive,0.95,"Matched taxonomy terms for Product & Service Quality: returns, wealth creators, risk management, resilience.",rule,"returns, wealth creators, risk management, resilience",a32d76c9e2839fc6
4,2026-03-12,CNBC-TV18,"A hybrid mutual fund has turned ₹1,000 monthly SIP into over ₹4 crore in 26 years","A ₹1,000 monthly SIP in ICICI Prudential Equity & Debt Fund since Nov 1999 would grow to ₹4 crore by Feb 28, 2026. A ₹1 lakh lump sum would","returns across market cycles. Sankaran Naren, ED & CIO, ICICI Prudential AMC, said, “Hybrid funds play an important role in helping",https://www.cnbctv18.com/personal-finance/icici-prudential-equity-debt-fund-1000-sip-into-4-crore-26-years-calculator-ws-el-19866594.htm,16655916,"A hybrid mutual fund has turned ₹1,000 monthly SIP into over ₹4 crore in 26 years A ₹1,000 monthly SIP in ICICI Prudential Equity & Debt Fund since Nov 1999 would grow to ₹4 crore by Feb 28, 2026. A ₹1 lakh lump sum would returns across market cycles. Sankaran Naren, ED & CIO, ICICI Prudential AMC, said, “Hybrid funds play an important role in helping",True,Brand mention includes a reputation-relevant BFSI context.,User Experience,Product & Service Quality,Positive,0.89,"Matched taxonomy terms for Product & Service Quality: returns, turned, crore, hybrid fund.",rule,"returns, turned, crore, hybrid fund",01fb862769d0f858
5,2025-10-20,The Economic Times,How to invest for a balanced portfolio this Diwali? 7 experts offer help,1 / 8 Financial investment this Diwali Are you planning to invest and have a balanced portfolio this Diwali? 7 experts offer help and,"keep it efficient. 4 / 8 Sankaran Naren, ED and CIO, ICICI Prudential Mutual Fund Asset allocation is of prime importance. So, the",https://economictimes.indiatimes.com/mf/analysis/how-to-invest-for-a-balanced-portfolio-this-diwali-7-experts-offer-help/slideshow/124704252.cms,23778251,"How to invest for a balanced portfolio this Diwali? 7 experts offer help 1 / 8 Financial investment this Diwali Are you planning to invest and have a balanced portfolio this Diwali? 7 experts offer help and keep it efficient. 4 / 8 Sankaran Naren, ED and CIO, ICICI Prudential Mutual Fund Asset allocation is of prime importance. So, the",True,Brand mention includes a reputation-relevant BFSI context.,Brand Perception,Thought Leadership,Neutral,0.95,"Matched taxonomy terms for Thought Leadership: cio, asset allocation, experts, sankaran naren, naren.",rule,"cio, asset allocation, experts, sankaran naren, naren",9d80cb52699930a4
6,2025-07-01,The Economic Times,NFO Update: ICICI Prudential Mutual Fund launches Nifty Private Bank Index Fund,"ICICI Prudential launches a Nifty Private Bank Index Fund, offering low-cost exposure to top private banks driving India’s growth. The",", and long-term potential in banking. ICICI Prudential Mutual Fund made a complete exit from three stocks in May. It sold Dr Lal Pathlabs,",https://economictimes.indiatimes.com/mf/mf-news/nfo-update-icici-prudential-mutual-fund-launches-nifty-private-bank-index-fund/articleshow/122176326.cms,62646070,"NFO Update: ICICI Prudential Mutual Fund launches Nifty Private Bank Index Fund ICICI Prudential launches a Nifty Private Bank Index Fund, offering low-cost exposure to top private banks driving India’s growth. The , and long-term potential in banking. ICICI Prudential Mutual Fund made a complete exit from three stocks in May. It sold Dr Lal Pathlabs,",True,Brand mention includes a reputation-relevant BFSI context.,Brand Perception,Product Strategy,Positive,0.95,"Matched taxonomy terms for Product Strategy: launches, nfo, index fund, offering, private bank index.",rule,"launches, nfo, index fund, offering, private bank index",a62d54c99f22f6a6
7,,Play Store,,"yours is the most hopeless mutual fund app ever in terms of registration i being a way long investor in mutual funds,have been using apps of different AMCs for long enjoyed comfortable and smooth usage.. until I got to know about your app God bless you",,https://play.google.com/store/apps/details?id=com.iPruAMC&hl=en_IN,,"yours is the most hopeless mutual fund app ever in terms of registration i being a way long investor in mutual funds,have been using apps of different AMCs for long enjoyed comfortable and smooth usage.. until I got to know about your app God bless you",True,Dataset-scoped app or service review retained based on BFSI experience signals.,User Experience,Digital & Omnichannel Experience,Negative,0.68,"Matched taxonomy terms for Digital & Omnichannel Experience: app, registration.",rule,"app, registration",879092e22349b248
9,2026-01-05,Moneycontrol,Active vs passive multi-asset funds: What’s the difference and how should investors choose?,Active management is based on the belief that skilled managers can generate alpha through market insight and tactical adjustments. Passive,"time. That’s why it is worth pausing when S Naren, CIO of ICICI Prudential AMC, chooses to invest his money in a passive multi-asset fund",https://www.moneycontrol.com/news/business/personal-finance/active-vs-passive-multi-asset-funds-what-s-the-difference-and-how-should-investors-choose-13755838.html,313329,"Active vs passive multi-asset funds: What’s the difference and how should investors choose? Active management is based on the belief that skilled managers can generate alpha through market insight and tactical adjustments. Passive time. That’s why it is worth pausing when S Naren, CIO of ICICI Prudential AMC, chooses to invest his money in a passive multi-asset fund",True,Brand mention includes a reputation-relevant BFSI context.,Brand Perception,Thought Leadership,Neutral,0.82,"Matched taxonomy terms for Thought Leadership: cio, s naren, naren.",rule,"cio, s naren, naren",c5d201ab10d540b6
11,2025-09-16,LinkedIn,,"🌟 A proud moment for us at Ekvity! Our Co-founder & Investment Advisor, Kharanshu Parikh , will be moderating a power-packed panel",": • Anurag M. – Head, Fixed Income, UTI AMC • Manish R Karnavar – Head, Family Office & Head – Product Communication (Mutual Funds), ICICI Prudential AMC • Deepak Agrawal – CIO – Debt & Head – Product, Kotak Mahindra MF 📅 Thursday, September 18, 2025 ⏰ 5 – 6 PM 📍 Zoom We’",https://www.linkedin.com/feed/update/urn%3Ali%3Aactivity%3A7373752780970344448,,"🌟 A proud moment for us at Ekvity! Our Co-founder & Investment Advisor, Kharanshu Parikh , will be moderating a power-packed panel : • Anurag M. – Head, Fixed Income, UTI AMC • Manish R Karnavar – Head, Family Office & Head – Product Communication (Mutual Funds), ICICI Prudential AMC • Deepak Agrawal – CIO – Debt & Head – Product, Kotak Mahindra MF 📅 Thursday, September 18, 2025 ⏰ 5 – 6 PM 📍 Zoom We’",True,Brand mention includes a reputation-relevant BFSI context.,Brand Perception,Thought Leadership,Neutral,0.61,Matched taxonomy terms for Thought Leadership: cio.,rule,cio,2dae90e8799d7e78
13,2026-03-06,LinkedIn,,"At the fourth edition of IDFC FIRST Bank Presents Outlook Money 40 After 40, Sankaran Naren , Executive Director & CIO, ICICI Prudential","At the fourth edition of IDFC FIRST Bank Presents Outlook Money 40 After 40, Sankaran Naren , Executive Director & CIO, ICICI Prudential AMC Ltd , shed light on some of the most overlooked risks in retirement planning today. With longer life expectancy and ever-increasing",https://www.linkedin.com/feed/update/urn%3Ali%3Aactivity%3A7435637202161922049,,"At the fourth edition of IDFC FIRST Bank Presents Outlook Money 40 After 40, Sankaran Naren , Executive Director & CIO, ICICI Prudential At the fourth edition of IDFC FIRST Bank Presents Outlook Money 40 After 40, Sankaran Naren , Executive Director & CIO, ICICI Prudential AMC Ltd , shed light on some of the most overlooked risks in retirement planning today. With longer life expectancy and ever-increasing",True,Brand mention includes a reputation-relevant BFSI context.,Brand Perception,Thought Leadership,Neutral,0.82,"Matched taxonomy terms for Thought Leadership: cio, sankaran naren, naren.",rule,"cio, sankaran naren, naren",d46d92261faa324a
14,2025-10-28,Moneycontrol,"Defence theme still has firepower but it is no longer a blind bet, say experts","The defence rally isn’t done yet, but fund managers say this leg of the journey will reward patience, selectivity, and real earnings power","narratives,” he said. Anish Tawakley, Co-CIO (Equity) at ICICI Prudential AMC, added a note of caution. “Defence has become a consensus",https://www.moneycontrol.com/news/business/markets/defence-theme-still-has-firepower-but-it-is-no-longer-a-blind-bet-say-experts-13638002.html,12772308,"Defence theme still has firepower but it is no longer a blind bet, say experts The defence rally isn’t done yet, but fund managers say this leg of the journey will reward patience, selectivity, and real earnings power narratives,” he said. Anish Tawakley, Co-CIO (Equity) at ICICI Prudential AMC, added a note of caution. “Defence has become a consensus",True,Brand mention includes a reputation-relevant BFSI context.,Brand Perception,Thought Leadership,Neutral,0.82,"Matched taxonomy terms for Thought Leadership: cio, fund manager, experts.",rule,"cio, fund manager, experts",6971d0d5d1e80494
15,2026-02-07,ET Now,"EXCLUSIVE | If AI trade cracks, can Indian markets outperform? ICICI Prudential's S Naren explains","S Naren described India as positioned as the ""anti-AI trade"" in a world pouring massive capital into AI infrastructure, particularly in",,https://www.etnownews.com/news/exclusive-if-ai-trade-cracks-can-indian-markets-outperform-icici-prudentials-s-naren-explains-article-153575256,11145929,"EXCLUSIVE | If AI trade cracks, can Indian markets outperform? ICICI Prudential's S Naren explains S Naren described India as positioned as the ""anti-AI trade"" in a world pouring massive capital into AI infrastructure, particularly in",True,Brand mention retained for reputation review.,Brand Perception,Thought Leadership,Neutral,0.82,"Matched taxonomy terms for Thought Leadership: explains, s naren, naren.",rule,"explains, s naren, naren",17bb44bbcc87b316
16,2025-08-12,reddit.com/r/mutualfunds,Has RBI removed the limits in foreign funds? I believe ICICI Prudential NASDAQ fund is open for investment. Can anyone please check? I can see there is no tracking error.,BI hasn't removed the restriction. A few funds open up time to time as AUM drops due to fluctuations in the market. ICICI Pru NASDAQ Fund was one of them. I believe the window for this fund has closed again. 9 rmadaan3 • 6mo ago Yup. I put in one SIP and it paused automatically today. 3 Fabulous_Educator_18 • 6mo ago It’s closed again.,,https://www.reddit.com/r/mutualfunds/comments/1mod0hr,,Has RBI removed the limits in foreign funds? I believe ICICI Prudential NASDAQ fund is open for investment. Can anyone please check? I can see there is no tracking error. BI hasn't removed the restriction. A few funds open up time to time as AUM drops due to fluctuations in the market. ICICI Pru NASDAQ Fund was one of them. I believe the window for this fund has closed again. 9 rmadaan3 • 6mo ago Yup. I put in one SIP and it paused automatically today. 3 Fabulous_Educator_18 • 6mo ago It’s closed again.,True,Brand mention includes a reputation-relevant BFSI context.,Brand Perception,Product Strategy,Neutral,0.68,Matched taxonomy terms for Product Strategy: open for investment.,rule,open for investment,68461c127ca424a2
18,2026-01-21,LinkedIn,,A heartfelt thank you to our esteemed #partners and #sponsors who continue to power the journey of GCA. As we celebrate the Silver Jubilee .,"of the Global Conference of Actuaries, we are delighted to welcome ACTEX Learning IIRM-Distance Learning Program @III @NII ICICI Prudential AMC Ltd onboard for #GCA26 . Your support strengthens our shared vision of advancing actuarial science and shaping the future of finance.",https://www.linkedin.com/feed/update/urn%3Ali%3Aactivity%3A7419685993731178496,,"A heartfelt thank you to our esteemed #partners and #sponsors who continue to power the journey of GCA. As we celebrate the Silver Jubilee . of the Global Conference of Actuaries, we are delighted to welcome ACTEX Learning IIRM-Distance Learning Program @III @NII ICICI Prudential AMC Ltd onboard for #GCA26 . Your support strengthens our shared vision of advancing actuarial science and shaping the future of finance.",True,Brand mention includes a reputation-relevant BFSI context.,User Experience,Customer Support & Complaint Resolution,Positive,0.61,Matched taxonomy terms for Customer Support & Complaint Resolution: support.,rule,support,29be0976e590e91b
19,,Play Store,,"Good thing, they did listen and introduced 'manage SIP' link. Upgrading rating to 4 accordingly Very unfriendly interface. Surprised that for a MF app, you can't even see your SIP list or easily edit it. Definitely need to improve and make it user friendly - have already shared concern on email, let's hope they improve in next version",,https://play.google.com/store/apps/details?id=com.iPruAMC&hl=en_IN,,"Good thing, they did listen and introduced 'manage SIP' link. Upgrading rating to 4 accordingly Very unfriendly interface. Surprised that for a MF app, you can't even see your SIP list or easily edit it. Definitely need to improve and make it user friendly - have already shared concern on email, let's hope they improve in next version",True,Dataset-scoped app or service review retained based on BFSI experience signals.,User Experience,Digital & Omnichannel Experience,Neutral,0.61,Matched taxonomy terms for Digital & Omnichannel Experience: app.,rule,app,8ef6f8282653c0b7
20,2025-12-24,The Hindu Business Line,Retail investors continue to bet big on ETFs,Investors are increasingly looking at exchange traded funds (ETFs – metals and equity) and index funds as a core allocation tool while,",” says Chintan Haria, Principal - Investment Strategy, ICICI Prudential AMC. Passives to rule 2026 While the demand for ETFs is",https://www.thehindubusinessline.com/markets/retail-investors-continue-to-bet-big-on-etfs/article70433732.ece,5621019,"Retail investors continue to bet big on ETFs Investors are increasingly looking at exchange traded funds (ETFs – metals and equity) and index funds as a core allocation tool while ,” says Chintan Haria, Principal - Investment Strategy, ICICI Prudential AMC. Passives to rule 2026 While the demand for ETFs is",True,Brand mention includes a reputation-relevant BFSI context.,Brand Perception,Product Strategy,Positive,0.68,Matched taxonomy terms for Product Strategy: index fund.,rule,index fund,a4ba9553e4bf86aa
21,2026-02-11,CNBC-TV18,"This mutual fund has turned a ₹10,000 monthly SIP into nearly ₹10 lakh in 5 years","ICICI Prudential Business Cycle Fund delivered a 18.47% CAGR for SIP investors in five years, outperforming Nifty 500 TRI. S Naren","S Naren, Executive Director and Chief Investment Officer at ICICI Prudential AMC, noted that “a large part of India’s economy is inherently",https://www.cnbctv18.com/personal-finance/icici-prudential-business-cycle-mutual-fund-sip-10000-into-10-lakh-5-years-ws-el-19847707.htm,14580306,"This mutual fund has turned a ₹10,000 monthly SIP into nearly ₹10 lakh in 5 years ICICI Prudential Business Cycle Fund delivered a 18.47% CAGR for SIP investors in five years, outperforming Nifty 500 TRI. S Naren S Naren, Executive Director and Chief Investment Officer at ICICI Prudential AMC, noted that “a large part of India’s economy is inherently",True,Brand mention includes a reputation-relevant BFSI context.,Brand Perception,Thought Leadership,Neutral,0.75,"Matched taxonomy terms for Thought Leadership: s naren, naren.",rule,"s naren, naren",c235e97e0f7ed8e0
22,2025-12-01,Dailyhunt,SEBI Gives Green Light To ICICI Prudential AMC's Mega IPO; 49 Million Shares On Offer,"The Securities and Exchange Board of India (SEBI), the capital markets regulator, has given Mumbai-based ICICI Prudential Asset Management",SEBI Gives Green Light To ICICI Prudential AMC's Mega IPO; 49 Million Shares On Offer,https://m.dailyhunt.in/news/india/english/goodreturns-epaper-goreturn/sebi+gives+green+light+to+icici+prudential+amc+s+mega+ipo+49+million+shares+on+offer-newsid-n691361025,,"SEBI Gives Green Light To ICICI Prudential AMC's Mega IPO; 49 Million Shares On Offer The Securities and Exchange Board of India (SEBI), the capital markets regulator, has given Mumbai-based ICICI Prudential Asset Management SEBI Gives Green Light To ICICI Prudential AMC's Mega IPO; 49 Million Shares On Offer",True,Brand mention includes a reputation-relevant BFSI context.,Responsible Business Practices,Regulatory Compliance & Ethical Governance,Neutral,0.61,Matched taxonomy terms for Regulatory Compliance & Ethical Governance: sebi.,rule,sebi,fef18d22861002c4
23,,Play Store,Digital Experience,"On Android, during any lumpsum payment, the transaction is successful but fails to redirect to the app. It stays stuck on the page that says that the transaction is successful for few seconds and then instead of redirecting to the app UI, it goes to be the browser which displays an error saying not authorised. Please fix that. Other than that, it is a massive improvement over the old app. What would also help is a XIRR calculation at the portfolio level. It shows absolute gain at the moment.",,https://play.google.com/store/apps/details?id=com.iPruAMC&hl=en_IN,,"Digital Experience On Android, during any lumpsum payment, the transaction is successful but fails to redirect to the app. It stays stuck on the page that says that the transaction is successful for few seconds and then instead of redirecting to the app UI, it goes to be the browser which displays an error saying not authorised. Please fix that. Other than that, it is a massive improvement over the old app. What would also help is a XIRR calculation at the portfolio level. It shows absolute gain at the moment.",True,Dataset-scoped app or service review retained based on BFSI experience signals.,User Experience,Digital & Omnichannel Experience,Negative,0.95,"Matched taxonomy terms for Digital & Omnichannel Experience: app, transaction, digital experience, redirect, not authorised.",rule,"app, transaction, digital experience, redirect, not authorised",9a9f69f7a1fce8ab
25,2025-12-09,The Financial Express,"Best low-cost retirement mutual fund: THIS ICICI Pru fund tops 1, 3 and 5-year return charts","ICICI Prudential Retirement Fund – Pure Equity – Direct Plan has emerged as the best-performing low-cost retirement mutual fund, topping 1,","retirement fund, launched on February 7, 2019 under the ICICI Prudential Mutual Fund umbrella. Since inception, it has delivered a robust",https://www.financialexpress.com/money/best-low-cost-retirement-mutual-fund-this-icici-pru-fund-tops-1-3-and-5-year-return-charts-4070465/,16655916,"Best low-cost retirement mutual fund: THIS ICICI Pru fund tops 1, 3 and 5-year return charts ICICI Prudential Retirement Fund – Pure Equity – Direct Plan has emerged as the best-performing low-cost retirement mutual fund, topping 1, retirement fund, launched on February 7, 2019 under the ICICI Prudential Mutual Fund umbrella. Since inception, it has delivered a robust",True,Brand mention includes a reputation-relevant BFSI context.,Brand Perception,Product Strategy,Positive,0.61,Matched taxonomy terms for Product Strategy: launched.,rule,launched,f58b9b3eee9d22ee
26,2025-09-30,Business Today,ICICI Prudential MF launches conglomerate-focused equity scheme,ICICI Prudential Conglomerate Fund’s investment universe includes significant representation from promoter-led groups with activity in,"Naren, executive director and chief investment officer at ICICI Prudential AMC. ICICI Prudential Mutual Fund underlined that",https://www.businesstoday.in/personal-finance/news/story/icici-prudential-conglomerate-equity-fund-nfo-october-496327-2025-09-30,33585792,"ICICI Prudential MF launches conglomerate-focused equity scheme ICICI Prudential Conglomerate Fund’s investment universe includes significant representation from promoter-led groups with activity in Naren, executive director and chief investment officer at ICICI Prudential AMC. ICICI Prudential Mutual Fund underlined that",True,Brand mention includes a reputation-relevant BFSI context.,Brand Perception,Product Strategy,Neutral,0.61,Matched taxonomy terms for Product Strategy: launches.,rule,launches,2666aec0d1600b9f
27,2025-12-09,LinkedIn,,Rajasthan and CSR Here are the Top 5 Districts and Top 5 CSR Contributors driving meaningful impact in Rajasthan. Stay connected as we,"all Indian States and UTs. Tell us in the comments which State you would like to see next! Hindustan Zinc , HDFC Bank , Chambal Fertilisers and Chemicals Limited , ICICI Prudential AMC Ltd , G R Infraprojects Limited Arun Marette Parthesh Vyas #CSRMaps #CSR #ImpactInvesting",https://www.linkedin.com/feed/update/urn%3Ali%3Aactivity%3A7404016966375522304,,"Rajasthan and CSR Here are the Top 5 Districts and Top 5 CSR Contributors driving meaningful impact in Rajasthan. Stay connected as we all Indian States and UTs. Tell us in the comments which State you would like to see next! Hindustan Zinc , HDFC Bank , Chambal Fertilisers and Chemicals Limited , ICICI Prudential AMC Ltd , G R Infraprojects Limited Arun Marette Parthesh Vyas #CSRMaps #CSR #ImpactInvesting",True,Brand mention includes a reputation-relevant BFSI context.,Responsible Business Practices,Social Impact & Community (CSR),Positive,0.61,Matched taxonomy terms for Social Impact & Community (CSR): csr.,rule,csr,f1825f30924de831
28,,Play Store,Digital Experience,"Absolutely love the new logo design.It's now very easy for someone like me who always forgets passwords.Previously, resetting my password felt discouraging. I also love the overall app experience.",,https://play.google.com/store/apps/details?id=com.iPruAMC&hl=en_IN,,"Digital Experience Absolutely love the new logo design.It's now very easy for someone like me who always forgets passwords.Previously, resetting my password felt discouraging. I also love the overall app experience.",True,Dataset-scoped app or service review retained based on BFSI experience signals.,User Experience,Digital & Omnichannel Experience,Positive,0.75,"Matched taxonomy terms for Digital & Omnichannel Experience: app, digital experience.",rule,"app, digital experience",645ca47096d1e673
29,,Mouthshut,Customer Support,"There is a definite downslide in their services and record keeping, , in one of our various schemes with this fund the statement of account issued by themseven years ago has rightly mentioned the nomination of my heir , , but their latest statement with the same folio is showing nomination required , , no rectification made despite reminders mailed",,https://www.mouthshut.com/product-reviews/icici-prudential-mutual-fund-reviews-925602486,,"Customer Support There is a definite downslide in their services and record keeping, , in one of our various schemes with this fund the statement of account issued by themseven years ago has rightly mentioned the nomination of my heir , , but their latest statement with the same folio is showing nomination required , , no rectification made despite reminders mailed",True,Dataset-scoped app or service review retained based on BFSI experience signals.,User Experience,Customer Support & Complaint Resolution,Negative,0.61,Matched taxonomy terms for Customer Support & Complaint Resolution: support.,rule,support,46b22189f62b2ba6
