source_row_id,date,source_name,title,opening_text,hit_sentence,url,reach,clean_text,is_relevant,relevance_reason,reputation_driver,sub_driver,sentiment,classification_confidence,classification_reason,classification_source,matched_terms,dedupe_key
40,2025-11-08,reddit.com/r/MutualfundsIndia,,,"hanks for the suggestion! I’ll definitely check out ICICI Prudential Multi Asset Fund. I like the idea of diversified allocation across equity/ debt/ gold, so it might fit well. Will study it properly before deciding.",https://www.reddit.com/r/MutualfundsIndia/comments/1p7wjb0/comment/nr110b9/,10617726,"hanks for the suggestion! I’ll definitely check out ICICI Prudential Multi Asset Fund. I like the idea of diversified allocation across equity/ debt/ gold, so it might fit well. Will study it properly before deciding.",True,Brand mention retained for reputation review.,User Experience,Product & Service Quality,Neutral,0.68,Matched taxonomy terms for Product & Service Quality: multi-asset.,rule,multi-asset,8bfd7ebb1a74dddd
41,,Play Store,,app's is very good but you tube channel not in Hindi.,,https://play.google.com/store/apps/details?id=com.iPruAMC&hl=en_IN,5345612,app's is very good but you tube channel not in Hindi.,True,Dataset-scoped app or service review retained based on BFSI experience signals.,User Experience,Digital & Omnichannel Experience,Positive,0.61,Matched taxonomy terms for Digital & Omnichannel Experience: app.,rule,app,8aafff04d4e46611
42,2025-07-18,LinkedIn,,Day 3 at the COFP Annual Retreat continued in full flow with an engaging and eye-opening session by Ms. Arpita Khadria on a topic many,nudged us to think harder about how we show up - and how we want to be remembered! Event Partners - HDFC Mutual Fund ICICI Prudential AMC Ltd Bajaj Finserv Asset Management Ltd SBI MUTUAL FUND Sundaram Finance WhiteOak Capital Mirae Asset Mutual Fund (India) Kotak Mutual Fund,https://www.linkedin.com/feed/update/urn%3Ali%3Aactivity%3A7351942345904357376,,Day 3 at the COFP Annual Retreat continued in full flow with an engaging and eye-opening session by Ms. Arpita Khadria on a topic many nudged us to think harder about how we show up - and how we want to be remembered! Event Partners - HDFC Mutual Fund ICICI Prudential AMC Ltd Bajaj Finserv Asset Management Ltd SBI MUTUAL FUND Sundaram Finance WhiteOak Capital Mirae Asset Mutual Fund (India) Kotak Mutual Fund,True,Brand mention includes a reputation-relevant BFSI context.,Brand Perception,Brand Visibility & Marketing,Neutral,0.61,Matched taxonomy terms for Brand Visibility & Marketing: event.,rule,event,4f667240c1361230
43,2025-09-08,The Economic Times,Dividend stock investing: How ICICI Prudential MF's Mittul Kalawadia balances growth with yields,"ICICI Prudential AMC's dividend yield strategy, led by Mittul Kalawadia, balances yield sustainability with growth potential across market",", Senior Fund Manager at ICICI Prudential AMC, explains how the fund house strikes the right balance between and . By focusing on",https://economictimes.indiatimes.com/markets/expert-view/dividend-stock-investing-how-icici-prudential-mfs-mittul-kalawadia-balances-growth-with-yields/articleshow/123747719.cms,801433,"Dividend stock investing: How ICICI Prudential MF's Mittul Kalawadia balances growth with yields ICICI Prudential AMC's dividend yield strategy, led by Mittul Kalawadia, balances yield sustainability with growth potential across market , Senior Fund Manager at ICICI Prudential AMC, explains how the fund house strikes the right balance between and . By focusing on",True,Brand mention includes a reputation-relevant BFSI context.,Brand Perception,Thought Leadership,Neutral,0.75,"Matched taxonomy terms for Thought Leadership: fund manager, explains.",rule,"fund manager, explains",9676b37898d6e8e8
44,2025-08-23,LinkedIn,,🌐 Clarity in Chaos Investors Market Dialogue - Wealth First Group - August 2025 We had the privilege of hosting an exclusive investor ca,"sectoral resilience provide balance. In uncertain times, perspectives like these help investors focus on what truly matters. 🙏 Thank you ICICI Prudential AMC Ltd , Anish Tawakley , Saurabh Mehta and Adrian D'souza for partnering with Wealth First to make this session impactful.",https://www.linkedin.com/feed/update/urn%3Ali%3Aactivity%3A7365018244723671040,,"🌐 Clarity in Chaos Investors Market Dialogue - Wealth First Group - August 2025 We had the privilege of hosting an exclusive investor ca sectoral resilience provide balance. In uncertain times, perspectives like these help investors focus on what truly matters. 🙏 Thank you ICICI Prudential AMC Ltd , Anish Tawakley , Saurabh Mehta and Adrian D'souza for partnering with Wealth First to make this session impactful.",True,Brand mention includes a reputation-relevant BFSI context.,User Experience,Product & Service Quality,Neutral,0.61,Matched taxonomy terms for Product & Service Quality: resilience.,rule,resilience,6374ee0b07fca19c
45,2025-11-29,MSN India,"ICICI Pru Value Fund: 50X growth in 21 years; Rs 5,000 monthly SIP builds over Rs 1 crore",; ; ; ICICI Prudential Value Fund is one of the few equity schemes that has successfully completed more than two decades in the market.,"under management and the largest equity fund within the ICICI Prudential Mutual Fund family. Over its full journey of 21 years, 3 months",https://www.msn.com/en-in/money/markets/icici-pru-value-fund-50x-growth-in-21-years-rs-5-000-monthly-sip-builds-over-rs-1-crore/ar-AA1RoQN3,,"ICICI Pru Value Fund: 50X growth in 21 years; Rs 5,000 monthly SIP builds over Rs 1 crore ; ; ; ICICI Prudential Value Fund is one of the few equity schemes that has successfully completed more than two decades in the market. under management and the largest equity fund within the ICICI Prudential Mutual Fund family. Over its full journey of 21 years, 3 months",True,Brand mention includes a reputation-relevant BFSI context.,User Experience,Product & Service Quality,Positive,0.61,Matched taxonomy terms for Product & Service Quality: crore.,rule,crore,a504c601acabc953
47,2025-11-26,Obnews,"A Monthly SIP of ₹10,000 in This ICICI Pru Fund Could Have Grown to ₹1 Crore Today",ICICI Prudential Largecap Fund has once again proved why it remains one of the most trusted mutual fund schemes for long-term wealth,,https://obnews.co/Index/flowNewsDetail/id/12856779.html,,"A Monthly SIP of ₹10,000 in This ICICI Pru Fund Could Have Grown to ₹1 Crore Today ICICI Prudential Largecap Fund has once again proved why it remains one of the most trusted mutual fund schemes for long-term wealth",True,Brand mention includes a reputation-relevant BFSI context.,User Experience,Product & Service Quality,Positive,0.75,"Matched taxonomy terms for Product & Service Quality: crore, long term.",rule,"crore, long term",e7b65826322d3479
48,2026-01-01,The Hindu Business Line,ICICI Pru AMC relieves Sankaran Naren from managing Dynamic Asset Allocation FoF,The fund management team has now been revised to include Sharmila D’silva,,https://www.thehindubusinessline.com/markets/icici-pru-amc-relieves-sankaran-naren-from-managing-dynamic-asset-allocation-fof/article70460288.ece,12220656,ICICI Pru AMC relieves Sankaran Naren from managing Dynamic Asset Allocation FoF The fund management team has now been revised to include Sharmila D’silva,True,Brand mention includes a reputation-relevant BFSI context.,Brand Perception,Thought Leadership,Neutral,0.89,"Matched taxonomy terms for Thought Leadership: asset allocation, sankaran naren, naren.",rule,"asset allocation, sankaran naren, naren",848e787f4f440d9c
49,2025-11-27,Goodreturns,"Best Mutual Funds: ICICI, HDFC, SBI Nippon Among Consistent Performers In Mid, Small, Large Cap Categories",Best Mutual Funds: Growing Systematic Investment Plan (SIP) inflows are a reflection of the growing trend of mutual fund investment in,,https://www.goodreturns.in/personal-finance/best-mutual-funds-icici-hdfc-sbi-nippon-among-consistent-performers-in-mid-small-large-cap-cate-1472803.html,6319982,"Best Mutual Funds: ICICI, HDFC, SBI Nippon Among Consistent Performers In Mid, Small, Large Cap Categories Best Mutual Funds: Growing Systematic Investment Plan (SIP) inflows are a reflection of the growing trend of mutual fund investment in",True,Dataset-scoped app or service review retained based on BFSI experience signals.,Brand Perception,Product Strategy,Positive,0.46,No exact taxonomy phrase matched; assigned to Product Strategy from broad context rules.,rule,,5a84ac25e86d54ca
51,2025-09-30,CNBC-TV18,ICICI Prudential MF launches conglomerate-themed fund; NFO opens in three days,"ICICI Prudential Mutual Fund will open its Conglomerate Fund NFO on Oct 3, targeting promoter-led groups across sectors.","ICICI Prudential Mutual Fund will open its Conglomerate Fund NFO on Oct 3, targeting promoter-led groups across sectors. ICICI Prudential",https://www.cnbctv18.com/personal-finance/icici-prudential-mf-launches-conglomerate-themed-fund-nfo-opens-in-three-days-19697278.htm,313329,"ICICI Prudential MF launches conglomerate-themed fund; NFO opens in three days ICICI Prudential Mutual Fund will open its Conglomerate Fund NFO on Oct 3, targeting promoter-led groups across sectors. ICICI Prudential Mutual Fund will open its Conglomerate Fund NFO on Oct 3, targeting promoter-led groups across sectors. ICICI Prudential",True,Brand mention includes a reputation-relevant BFSI context.,Brand Perception,Product Strategy,Neutral,0.68,"Matched taxonomy terms for Product Strategy: launches, nfo.",rule,"launches, nfo",fb5db5d22c139c36
52,2025-08-05,Zee Business,Top 7 largecap mutual funds; know how much return top fund has given in 5 years,The seventh fund on the list is Baroda BNP Paribas Large Cap Fund. It has given a 16.56 per cent SIP return in five years. The fund size is,,https://www.zeebiz.com/personal-finance/mutual-fund/photo-gallery-nippon-india-icici-prudential-invesco-india-dsg-large-cap-hdfc-bandhan-baroda-bnp-paribas-direct-growth-large-cap-funds-with-highest-mutual-fund-sip-return-calculator-375570,58845,Top 7 largecap mutual funds; know how much return top fund has given in 5 years The seventh fund on the list is Baroda BNP Paribas Large Cap Fund. It has given a 16.56 per cent SIP return in five years. The fund size is,True,Dataset-scoped app or service review retained based on BFSI experience signals.,User Experience,Product & Service Quality,Neutral,0.61,Matched taxonomy terms for Product & Service Quality: return.,rule,return,3fb1e7d71233819c
53,,Play Store,,"Cam be improved by adding 1. details of amount received for processing with scheme name, likely unit allotment date etc., 2. display pending/scheduled transactions of SIP, STP, SWP etc., 3. view/modify/pause/cancel SIPs. STPs. SWPs etc., 4. speed up processing by preventing lag",,https://play.google.com/store/apps/details?id=com.iPruAMC&hl=en_IN,,"Cam be improved by adding 1. details of amount received for processing with scheme name, likely unit allotment date etc., 2. display pending/scheduled transactions of SIP, STP, SWP etc., 3. view/modify/pause/cancel SIPs. STPs. SWPs etc., 4. speed up processing by preventing lag",True,Dataset-scoped app or service review retained based on BFSI experience signals.,User Experience,Digital & Omnichannel Experience,Negative,0.75,"Matched taxonomy terms for Digital & Omnichannel Experience: transactions, processing, lag.",rule,"transactions, processing, lag",8ef00f12567c0dc1
55,2025-10-28,Moneycontrol,"After the midcap mania, market experts bet on largecaps for next round of alpha","With mid and small caps trading at frothy valuations, fund managers at the Moneycontrol Mutual Fund Summit 2025 said large caps could lead","may come from large caps. Anish Tawakley, Co-CIO (Equity), ICICI Prudential AMC, said the market’s recent consolidation was natural after",https://www.moneycontrol.com/news/business/markets/after-the-midcap-mania-market-experts-bet-on-largecaps-for-next-round-of-alpha-13637978.html,14973137,"After the midcap mania, market experts bet on largecaps for next round of alpha With mid and small caps trading at frothy valuations, fund managers at the Moneycontrol Mutual Fund Summit 2025 said large caps could lead may come from large caps. Anish Tawakley, Co-CIO (Equity), ICICI Prudential AMC, said the market’s recent consolidation was natural after",True,Brand mention includes a reputation-relevant BFSI context.,Brand Perception,Thought Leadership,Neutral,0.82,"Matched taxonomy terms for Thought Leadership: cio, fund manager, experts.",rule,"cio, fund manager, experts",248eb020a754deb6
56,2025-10-22,Zee Business,"Top 7 Large & Midcap Mutual Funds in 5 Years: Rs 16,00,000 lump sum investment in No. 1 scheme has led to Rs 60.3 lakh wealth",Large & midcap mutual funds are equity funds that invest in both largecap and midcap companies. These funds invest in the top 200 companies,,https://www.zeebiz.com/personal-finance/mutual-fund/photo-gallery-top-7-large-and-midcap-mutual-funds-in-5-years-rs-1600000-lump-sum-investment-in-no-1-scheme-has-led-to-rs-603-lakh-motilaloswal-icici-hdfc-invesco-quant-uti-bandhan-381475,189838,"Top 7 Large & Midcap Mutual Funds in 5 Years: Rs 16,00,000 lump sum investment in No. 1 scheme has led to Rs 60.3 lakh wealth Large & midcap mutual funds are equity funds that invest in both largecap and midcap companies. These funds invest in the top 200 companies",True,Dataset-scoped app or service review retained based on BFSI experience signals.,Brand Perception,Product Strategy,Neutral,0.46,No exact taxonomy phrase matched; assigned to Product Strategy from broad context rules.,rule,scheme,e727b2958b1bd025
57,2025-11-19,Equitymaster,2026 Watchlist: 3 High-Performing Multi Cap Mutual Funds,"Image source: ipopba/www.istockphoto.com If you want to maintain a balanced approach to largecaps, midcaps, and smallcaps, then among the",,https://www.equitymaster.com/the-fundstrategist/detail.asp?date=11/19/2025&story=5&title=2026-Watchlist-3-High%2DPerforming-Multi-Cap-Mutual-Funds,347930,"2026 Watchlist: 3 High-Performing Multi Cap Mutual Funds Image source: ipopba/www.istockphoto.com If you want to maintain a balanced approach to largecaps, midcaps, and smallcaps, then among the",True,Dataset-scoped app or service review retained based on BFSI experience signals.,User Experience,Digital & Omnichannel Experience,Positive,0.46,No exact taxonomy phrase matched; assigned to Digital & Omnichannel Experience from broad context rules.,rule,app,cfb03efc9c8f8e4c
58,2025-09-01,The Economic Times,Nifty Next 50: Can this be your next move in largecap investing,"What next? We often ask ourselves this question as we move ahead in life - after passing an important academic exam, after getting promoted",- Chintan Haria is Principal- Investment Strategy at ICICI Prudential AMC) Add as a Reliable and Trusted News Source Add Now!,https://economictimes.indiatimes.com/mf/analysis/nifty-next-50-can-this-be-your-next-move-in-largecap-investing/articleshow/123632272.cms,25558809,"Nifty Next 50: Can this be your next move in largecap investing What next? We often ask ourselves this question as we move ahead in life - after passing an important academic exam, after getting promoted - Chintan Haria is Principal- Investment Strategy at ICICI Prudential AMC) Add as a Reliable and Trusted News Source Add Now!",True,Brand mention includes a reputation-relevant BFSI context.,Brand Perception,Product Strategy,Positive,0.46,No exact taxonomy phrase matched; assigned to Product Strategy from broad context rules.,rule,,2352f1c20c643c14
59,2025-11-25,The Times of India,"How to be a value investor when Nifty is at 26,000, Sensex at 85,000: Guide to finding value when the market looks pricey","Even with Nifty at 26,000 and Sensex at 85,000, value investing opportunities persist. Focus on fundamentally sound businesses overlooked","of the year. Then a warning from Sankaran Naren, CIO of ICICI Prudential Mutual Fund, triggered an alarm in the markets. By March 2025,",https://timesofindia.indiatimes.com/business/financial-literacy/investing/how-to-be-a-value-investor-when-nifty-is-at-26000-sensex-at-85000-guide-to-finding-value-when-the-market-looks-pricey/articleshow/125557554.cms,7749939,"How to be a value investor when Nifty is at 26,000, Sensex at 85,000: Guide to finding value when the market looks pricey Even with Nifty at 26,000 and Sensex at 85,000, value investing opportunities persist. Focus on fundamentally sound businesses overlooked of the year. Then a warning from Sankaran Naren, CIO of ICICI Prudential Mutual Fund, triggered an alarm in the markets. By March 2025,",True,Brand mention includes a reputation-relevant BFSI context.,Brand Perception,Thought Leadership,Positive,0.82,"Matched taxonomy terms for Thought Leadership: cio, sankaran naren, naren.",rule,"cio, sankaran naren, naren",1ddf06a1d92ee003
60,2026-01-05,CNBC-TV18,Why ICICI Pru's Chintan Haria believes SIPs and passive funds will stay in focus in 2026,"Chintan Haria of ICICI Prudential AMC predicts investors will favor SIPs, diversified mutual funds, and ETFs like Nifty 500, Nifty Next 50,","to Chintan Haria, Principal – Investment Strategy at ICICI Prudential AMC. Periods of market swings, he said, tend to highlight the",https://www.cnbctv18.com/personal-finance/icici-pru-chintan-haria-sips-passive-mutual-funds-2026-outlook-etfs-ws-l-19814058.htm,,"Why ICICI Pru's Chintan Haria believes SIPs and passive funds will stay in focus in 2026 Chintan Haria of ICICI Prudential AMC predicts investors will favor SIPs, diversified mutual funds, and ETFs like Nifty 500, Nifty Next 50, to Chintan Haria, Principal – Investment Strategy at ICICI Prudential AMC. Periods of market swings, he said, tend to highlight the",True,Brand mention includes a reputation-relevant BFSI context.,Brand Perception,Product Strategy,Neutral,0.46,No exact taxonomy phrase matched; assigned to Product Strategy from broad context rules.,rule,,497631c07111c9a0
61,,Play Store,Digital Experience,"Worst update ever – keeps logging out automatically! 😡 After the latest update, this app has become completely useless. It keeps logging me out automatically every single time. Such a third-class experience! The developers should test the software properly before releasing updates. This is really frustrating and unprofessional. Please fix this issue immediately and make sure future updates are properly checked before release. 👎",,https://play.google.com/store/apps/details?id=com.iPruAMC&hl=en_IN,,"Digital Experience Worst update ever – keeps logging out automatically! 😡 After the latest update, this app has become completely useless. It keeps logging me out automatically every single time. Such a third-class experience! The developers should test the software properly before releasing updates. This is really frustrating and unprofessional. Please fix this issue immediately and make sure future updates are properly checked before release. 👎",True,Dataset-scoped app or service review retained based on BFSI experience signals.,User Experience,Digital & Omnichannel Experience,Negative,0.89,"Matched taxonomy terms for Digital & Omnichannel Experience: app, digital experience, logging out.",rule,"app, digital experience, logging out",1d08c3cfd81071ca
62,2025-09-29,Money9live,"S. Naren का Market Forecast, जानें बाजार को लेकर क्या है राय और निवेशकों की क्या हो स्ट्रैटेजी?","पिछले एक दशक में भारतीय बाजार ने जो तेजी बनाई है उसने दुनियाभर के कई बाजारों को पीछे छोड़ दिया है. लेकिन अचानक से एक साल में सब पलट गया,","को क्या रणनीति अपनानी चाहिए. इन सभी मुद्दों पर क्या है ICICI Prudential Mutual Fund CIO S. Naren की राय, चलिए आपको बताते हैं इस वीडियो में.",https://www.money9live.com/share-market/s-naren-market-forecast-know-what-is-opinion-about-market-and-what-should-be-strategy-of-investors-video-72847.html,2033792,"S. Naren का Market Forecast, जानें बाजार को लेकर क्या है राय और निवेशकों की क्या हो स्ट्रैटेजी? पिछले एक दशक में भारतीय बाजार ने जो तेजी बनाई है उसने दुनियाभर के कई बाजारों को पीछे छोड़ दिया है. लेकिन अचानक से एक साल में सब पलट गया, को क्या रणनीति अपनानी चाहिए. इन सभी मुद्दों पर क्या है ICICI Prudential Mutual Fund CIO S. Naren की राय, चलिए आपको बताते हैं इस वीडियो में.",True,Brand mention includes a reputation-relevant BFSI context.,Brand Perception,Thought Leadership,Neutral,0.82,"Matched taxonomy terms for Thought Leadership: cio, s naren, naren.",rule,"cio, s naren, naren",9da53d5710075b07
63,2025-07-23,Angel One,Best Gold ETFs in India in August 2025 Based on 5yr CAGR,"ICICI Prudential, HDFC, SBI, Kotak, and Nippon India ETFs lead the list of best Gold ETFs in India for August 2025 by CAGR and returns.",,https://www.angelone.in/news/best-gold-etfs-in-india-in-august-2025,16655916,"Best Gold ETFs in India in August 2025 Based on 5yr CAGR ICICI Prudential, HDFC, SBI, Kotak, and Nippon India ETFs lead the list of best Gold ETFs in India for August 2025 by CAGR and returns.",True,Brand mention includes a reputation-relevant BFSI context.,User Experience,Product & Service Quality,Neutral,0.61,Matched taxonomy terms for Product & Service Quality: returns.,rule,returns,afe3c31120bd8348
65,2026-01-25,Fortune India,Best Investments 2026: The best debt fund manager,Avoiding dramatic bets has helped Manish Banthia deliver in a volatile market.,"Manish Banthia, chief investment officer, fixed income, ICICI Prudential AMC INVESTORS VIEW fixed income as the calmer part of the market",https://www.fortuneindia.com/long-reads/best-investments-2026-the-best-debt-fund-manager/129359,,"Best Investments 2026: The best debt fund manager Avoiding dramatic bets has helped Manish Banthia deliver in a volatile market. Manish Banthia, chief investment officer, fixed income, ICICI Prudential AMC INVESTORS VIEW fixed income as the calmer part of the market",True,Brand mention includes a reputation-relevant BFSI context.,Brand Perception,Thought Leadership,Positive,0.68,Matched taxonomy terms for Thought Leadership: fund manager.,rule,fund manager,c02bec8b1624186f
66,2025-08-12,Zee Business,"Top 6 MF Schemes in 3 Years: These largecap, midcap, smallcap funds have beaten benchmarks with up to 21% returns; see list","Equity mutual funds have been the talk of the town for the past several months, and counting, with schemes across largecap, midcap and",,https://www.zeebiz.com/personal-finance/mutual-fund/photo-gallery-top-largecap-midcap-smallcap-mutual-funds-in-3-years-list-aug-11-2025-bse-nifty-100-midcap-150-smallcap-250-tri-benchmark-beating-schemes-list-376128,41256,"Top 6 MF Schemes in 3 Years: These largecap, midcap, smallcap funds have beaten benchmarks with up to 21% returns; see list Equity mutual funds have been the talk of the town for the past several months, and counting, with schemes across largecap, midcap and",True,Dataset-scoped app or service review retained based on BFSI experience signals.,User Experience,Product & Service Quality,Neutral,0.61,Matched taxonomy terms for Product & Service Quality: returns.,rule,returns,ebce0fdb66819be2
