source_row_id,date,source_name,title,opening_text,hit_sentence,url,reach,clean_text,is_relevant,relevance_reason,reputation_driver,sub_driver,sentiment,classification_confidence,classification_reason,classification_source,matched_terms,dedupe_key
67,2025-08-13,reddit.com/r/MutualfundsIndia,,"Need Advice for ICICI Thematic Advantage & ICICI Equity Savings for 3-Year Horizon (Low Risk, Emergency-Ready) Hi everyone, I’m planning to invest ₹10–20 lakh (my mother’s savings) and have shortlisted and will only go with these two mutual funds: ICICI Prudential Thematic Advantage Fund ICICI Prudential Equity Savings Fund Time Horizon: Around 3 years, but I may need to withdraw earlier in case of an emergency. Goal: Low risk — I want to ensure the money isn’t at a decreased value if withdrawn before 3 years. Risk Tolerance: Low to moderate (primary focus on capital protection, but want returns better than FD and which can beat inflation in the long run). Reason for Selection: I’ve already decided on these two funds based on past performance and stability — just need help in deciding the right allocation ratio. My Questions: Should I invest all the amount in one of these, or split between them? If split, what ratio is best for low risk and emergency liquidity? How much downside risk should I expect if I need to redeem within 1–2 years? Your suggestions will really help, this is a retirement-focused saving for my mom and dad and for our education. Thanks in advance! Update: Please also explain what is diff between direct or regular fund and with which we should move ahead?","I would’ve picked an Arbitrage fund or a Short Term Debt Fund for this. But if I’m forced to choose 1 out of the aforementioned choices, I would pick ICICI Equity Savings Fund since it’s a tax efficient version of a Conservative Hybrid Fund. Maybe I’d have divided the money between an Arbitrage Fund and the Equity Savings Fund",https://www.reddit.com/r/MutualfundsIndia/comments/1moy5u1/comment/n8gj41q,347930,"Need Advice for ICICI Thematic Advantage & ICICI Equity Savings for 3-Year Horizon (Low Risk, Emergency-Ready) Hi everyone, I’m planning to invest ₹10–20 lakh (my mother’s savings) and have shortlisted and will only go with these two mutual funds: ICICI Prudential Thematic Advantage Fund ICICI Prudential Equity Savings Fund Time Horizon: Around 3 years, but I may need to withdraw earlier in case of an emergency. Goal: Low risk — I want to ensure the money isn’t at a decreased value if withdrawn before 3 years. Risk Tolerance: Low to moderate (primary focus on capital protection, but want returns better than FD and which can beat inflation in the long run). Reason for Selection: I’ve already decided on these two funds based on past performance and stability — just need help in deciding the right allocation ratio. My Questions: Should I invest all the amount in one of these, or split between them? If split, what ratio is best for low risk and emergency liquidity? How much downside risk should I expect if I need to redeem within 1–2 years? Your suggestions will really help, this is a retirement-focused saving for my mom and dad and for our education. Thanks in advance! Update: Please also explain what is diff between direct or regular fund and with which we should move ahead? I would’ve picked an Arbitrage fund or a Short Term Debt Fund for this. But if I’m forced to choose 1 out of the aforementioned choices, I would pick ICICI Equity Savings Fund since it’s a tax efficient version of a Conservative Hybrid Fund. Maybe I’d have divided the money between an Arbitrage Fund and the Equity Savings Fund",True,Brand mention includes a reputation-relevant BFSI context.,User Experience,Product & Service Quality,Neutral,0.89,"Matched taxonomy terms for Product & Service Quality: returns, performance, downside, hybrid fund.",rule,"returns, performance, downside, hybrid fund",9bac0953488f6060
68,,Play Store,,"have you checked your buggy app before the new launch? during the transaction while entering the pin it says sim change detected. why does it keep saying sim change detected. Reinstalling this app , clearing the data is not fixing this issue.",,https://play.google.com/store/apps/details?id=com.iPruAMC&hl=en_IN,,"have you checked your buggy app before the new launch? during the transaction while entering the pin it says sim change detected. why does it keep saying sim change detected. Reinstalling this app , clearing the data is not fixing this issue.",True,Dataset-scoped app or service review retained based on BFSI experience signals.,User Experience,Digital & Omnichannel Experience,Negative,0.89,"Matched taxonomy terms for Digital & Omnichannel Experience: app, transaction, reinstalling, sim change.",rule,"app, transaction, reinstalling, sim change",a4e7fc121f2f682c
70,,Play Store,Digital Experience,"have you checked your buggy app before the new launch? during the transaction while entering the pin it says sim change detected. why does it keep saying sim change detected. Reinstalling this app , clearing the data is not fixing this issue.",,https://play.google.com/store/apps/details?id=com.iPruAMC&hl=en_IN,,"Digital Experience have you checked your buggy app before the new launch? during the transaction while entering the pin it says sim change detected. why does it keep saying sim change detected. Reinstalling this app , clearing the data is not fixing this issue.",True,Dataset-scoped app or service review retained based on BFSI experience signals.,User Experience,Digital & Omnichannel Experience,Negative,0.95,"Matched taxonomy terms for Digital & Omnichannel Experience: app, transaction, digital experience, reinstalling, sim change.",rule,"app, transaction, digital experience, reinstalling, sim change",0c52c59a543c898e
71,2025-08-14,Obnews,"Best SIP Plans in India for Beginners: Low Risk, High Returns Options","Starting your investment journey? SIPs are a great way to begin. Learn about the best low-risk SIP options in India for 2025, balancing",,https://obnews.co/Index/flowNewsDetail/id/11578682.html,3531794,"Best SIP Plans in India for Beginners: Low Risk, High Returns Options Starting your investment journey? SIPs are a great way to begin. Learn about the best low-risk SIP options in India for 2025, balancing",True,Dataset-scoped app or service review retained based on BFSI experience signals.,Brand Perception,Product Strategy,Positive,0.68,Matched taxonomy terms for Product Strategy: sip plan.,rule,sip plan,8a6400ed13153a8f
72,2025-08-25,BW BusinessWorld,Icici Prudential Asset Management Company Inaugurates New Office At Gift City; Announces India- Focused Fund For Global Investors,"The IFSC Branch was inaugurated by Amar Shah, Chief Business Officer, ICICI Prudential AMC. Also, seen in the picture are Ashutosh Mishra,","was inaugurated by Amar Shah, Chief Business Officer, ICICI Prudential AMC. Also, seen in the picture are Ashutosh Mishra, Principal",https://www.businessworld.in/article/icici-prudential-asset-management-company-inaugurates-new-office-at-gift-city-announces-india-focused-fund-for-global-investors-568768,285637,"Icici Prudential Asset Management Company Inaugurates New Office At Gift City; Announces India- Focused Fund For Global Investors The IFSC Branch was inaugurated by Amar Shah, Chief Business Officer, ICICI Prudential AMC. Also, seen in the picture are Ashutosh Mishra, was inaugurated by Amar Shah, Chief Business Officer, ICICI Prudential AMC. Also, seen in the picture are Ashutosh Mishra, Principal",True,Brand mention includes a reputation-relevant BFSI context.,Brand Perception,Product Strategy,Neutral,0.46,No exact taxonomy phrase matched; assigned to Product Strategy from broad context rules.,rule,,02e40a65a638fa3b
73,2025-10-27,NewsPoint,"12 equity mutual funds with over Rs 1,000 NAV deliver over 15% CAGR since inception","Around 12 equity mutual funds had a net asset value ( NAV ) of over Rs 1,000 as of October 24, 2025, and have delivered over 15% CAGR since",,https://www.newspointapp.com/english/business/12-equity-mutual-funds-with-over-rs-1000-nav-deliver-over-15-cagr-since-inception-et/articleshow/145048209f0dd225f005284a4b8acb05ea7e08af,12220656,"12 equity mutual funds with over Rs 1,000 NAV deliver over 15% CAGR since inception Around 12 equity mutual funds had a net asset value ( NAV ) of over Rs 1,000 as of October 24, 2025, and have delivered over 15% CAGR since",True,Dataset-scoped app or service review retained based on BFSI experience signals.,User Experience,Product & Service Quality,Neutral,0.61,Matched taxonomy terms for Product & Service Quality: nav.,rule,nav,f315724e01fef9a4
75,2025-11-04,The Economic Times,"All the risk now lies with investors, warns ICICI Prudential AMC’s Sankaran Naren","ICICI Prudential AMC CIO Sankaran Naren warned that investment risks now lie entirely with investors, urging diversification into debt and","ICICI Prudential AMC CIO Sankaran Naren warned that investment risks now lie entirely with investors, urging diversification into debt and",https://economictimes.indiatimes.com/mf/mf-news/all-the-risk-now-lies-with-investors-warns-icici-prudential-amcs-sankaran-naren/articleshow/125086832.cms,347930,"All the risk now lies with investors, warns ICICI Prudential AMC’s Sankaran Naren ICICI Prudential AMC CIO Sankaran Naren warned that investment risks now lie entirely with investors, urging diversification into debt and ICICI Prudential AMC CIO Sankaran Naren warned that investment risks now lie entirely with investors, urging diversification into debt and",True,Brand mention includes a reputation-relevant BFSI context.,Brand Perception,Thought Leadership,Neutral,0.82,"Matched taxonomy terms for Thought Leadership: cio, sankaran naren, naren.",rule,"cio, sankaran naren, naren",7b3ca1fd000a3692
76,2025-07-10,CNBC-TV18,Why ICICI Pru MF’s Chintan Haria believes it’s time to look at quality smart beta investing,"Haria explains that when markets turn cautious, investors hunt for fundamentally sound companies—those with strong balance sheets, high","now. Chintan Haria, Principal – Investment Strategy at ICICI Prudential Mutual Fund, believes the signals are lining up. “Quality tends",https://www.cnbctv18.com/personal-finance/icici-pru-chintan-haria-explains-why-time-to-look-at-quality-smart-beta-investing-19635083.htm,11569309,"Why ICICI Pru MF’s Chintan Haria believes it’s time to look at quality smart beta investing Haria explains that when markets turn cautious, investors hunt for fundamentally sound companies—those with strong balance sheets, high now. Chintan Haria, Principal – Investment Strategy at ICICI Prudential Mutual Fund, believes the signals are lining up. “Quality tends",True,Brand mention includes a reputation-relevant BFSI context.,Brand Perception,Thought Leadership,Positive,0.61,Matched taxonomy terms for Thought Leadership: explains.,rule,explains,cad9b12cd04262f1
77,2025-11-24,LinkedIn,"He will be sharing his insights on “Indian Opportunities Amid Global Uncertainties.” on Saturday, 29th November'25.","We are pleased to announce that Anish Tawakley , Deputy CIO – Equity, ICICI Prudential AMC Ltd , will be joining us at our Annual Event for","We are pleased to announce that Anish Tawakley , Deputy CIO – Equity, ICICI Prudential AMC Ltd , will be joining us at our Annual Event for a special session moderated by Sapna Narang , Managing Partner, Capital League. He will be sharing his insights on “Indian Opportunities",https://www.linkedin.com/feed/update/urn%3Ali%3Aactivity%3A7398646200603897857,,"He will be sharing his insights on “Indian Opportunities Amid Global Uncertainties.” on Saturday, 29th November'25. We are pleased to announce that Anish Tawakley , Deputy CIO – Equity, ICICI Prudential AMC Ltd , will be joining us at our Annual Event for We are pleased to announce that Anish Tawakley , Deputy CIO – Equity, ICICI Prudential AMC Ltd , will be joining us at our Annual Event for a special session moderated by Sapna Narang , Managing Partner, Capital League. He will be sharing his insights on “Indian Opportunities",True,Brand mention includes a reputation-relevant BFSI context.,Brand Perception,Thought Leadership,Neutral,0.61,Matched taxonomy terms for Thought Leadership: cio.,rule,cio,90acee5e5cb811c5
78,2025-09-08,NewsPoint,"50% US tariffs will change: A. Shah, ICICI Pru AMC","Anand Shah, CIO-PMS and AIF Investments, ICICI Prudential AMC , in an interview that he expects tariff resolution through dialogue. He","Anand Shah, CIO-PMS and AIF Investments, ICICI Prudential AMC , in an interview that he expects tariff resolution through dialogue. He",https://www.newspointapp.com/english-news/publisher-et/business/50-us-tariffs-will-change-a-shah-icici-pru-amc/articleshow/14504820656adbf90647eff5c0e2172a0cdbb6f8,25084627,"50% US tariffs will change: A. Shah, ICICI Pru AMC Anand Shah, CIO-PMS and AIF Investments, ICICI Prudential AMC , in an interview that he expects tariff resolution through dialogue. He Anand Shah, CIO-PMS and AIF Investments, ICICI Prudential AMC , in an interview that he expects tariff resolution through dialogue. He",True,Brand mention includes a reputation-relevant BFSI context.,Brand Perception,Thought Leadership,Neutral,0.68,"Matched taxonomy terms for Thought Leadership: cio, interview.",rule,"cio, interview",9b02914ebd5a9e51
79,2026-01-24,Moneycontrol,"ICICI Pru Passive Multi-Asset FoF to be ""grandfathered""; new Investments to stop from January 27","As part of the grandfathering process, the scheme will continue with its current structure but will be merged and/or wound up upon",,https://www.moneycontrol.com/news/business/markets/icici-pru-passive-multi-asset-fof-to-be-grandfathered-new-investments-to-stop-from-january-27-13789521.html,8244574,"ICICI Pru Passive Multi-Asset FoF to be ""grandfathered""; new Investments to stop from January 27 As part of the grandfathering process, the scheme will continue with its current structure but will be merged and/or wound up upon",True,Brand mention includes a reputation-relevant BFSI context.,User Experience,Product & Service Quality,Neutral,0.68,Matched taxonomy terms for Product & Service Quality: multi-asset.,rule,multi-asset,a5618d44565816fa
80,2026-01-27,CNBC-TV18,"ICICI Prudential AMC turns constructive on equities, sees opportunity after market correction","ICICI Prudential AMC’s Chintan Haria explains why the fund house has reopened small-cap and international funds, highlighting opportunities",ICICI Prudential AMC has turned constructive on equities after a broad-based correction in Indian markets over the last few months. The,https://www.cnbctv18.com/personal-finance/icici-prudential-amc-turns-constructive-on-equities-sees-opportunity-after-market-correction-19834050.htm,2115326,"ICICI Prudential AMC turns constructive on equities, sees opportunity after market correction ICICI Prudential AMC’s Chintan Haria explains why the fund house has reopened small-cap and international funds, highlighting opportunities ICICI Prudential AMC has turned constructive on equities after a broad-based correction in Indian markets over the last few months. The",True,Brand mention includes a reputation-relevant BFSI context.,User Experience,Product & Service Quality,Positive,0.61,Matched taxonomy terms for Product & Service Quality: turned.,rule,turned,bd3e11d3c06a9b3f
83,2025-12-08,Moneycontrol,MC EXCLUSIVE India is an infinite market at the right price: ICICI Pru AMC's Nimesh Shah bets on scale over margins,"As the AMC heads into its IPO, Shah says low fees strengthen — not strain — the business, backed by counter-cyclical products and a rapidly","Nimesh Shah If you can deliver a low-cost product to India’s middle class, the market is “infinite,” says ICICI Prudential AMC Managing",https://www.moneycontrol.com/news/business/markets/india-is-an-infinite-market-at-the-right-price-icici-pru-amc-s-nimesh-shah-bets-on-scale-over-margins-13715529.html,14026100,"MC EXCLUSIVE India is an infinite market at the right price: ICICI Pru AMC's Nimesh Shah bets on scale over margins As the AMC heads into its IPO, Shah says low fees strengthen — not strain — the business, backed by counter-cyclical products and a rapidly Nimesh Shah If you can deliver a low-cost product to India’s middle class, the market is “infinite,” says ICICI Prudential AMC Managing",True,Brand mention includes a reputation-relevant BFSI context.,Brand Perception,Product Strategy,Positive,0.46,No exact taxonomy phrase matched; assigned to Product Strategy from broad context rules.,rule,,6128db55f073ba0d
84,2025-07-07,reddit.com/r/mutualfunds,Is ICICI Prudential Bluechip Fund and ICICI Prudential Large cap fund the same? I wanted to invest in ICICI Prudential Bluechip fund but couldn't find it on Zerodha Kite. I read somewhere that it was renamed to ICICI Prudential Large cap some time back. Can anyone confirm this if they're the same fund so I don't invest in the wrong one. yes,,,https://www.reddit.com/r/mutualfunds/comments/1ltxde3,,Is ICICI Prudential Bluechip Fund and ICICI Prudential Large cap fund the same? I wanted to invest in ICICI Prudential Bluechip fund but couldn't find it on Zerodha Kite. I read somewhere that it was renamed to ICICI Prudential Large cap some time back. Can anyone confirm this if they're the same fund so I don't invest in the wrong one. yes,True,Brand mention retained for reputation review.,Brand Perception,Product Strategy,Neutral,0.46,No exact taxonomy phrase matched; assigned to Product Strategy from broad context rules.,rule,,45055a10b8828313
85,2025-11-04,NewsPoint,Passive investing now a core strategy for portfolio building: ICICI Pru expert,Kolkata: The popularity of passive investments is rising at an astonishing pace. The AUM in Sept 2025 for passive mutual fund schemes,"be higher. Chintan Haria, principal, investment strategy ICICI Prudential AMC explains the reasons behind the popularity of passive",https://www.newspointapp.com/english/astro/passive-investing-now-a-core-strategy-for-portfolio-building-icici-pru-expert-news9live-english/articleshow/14504820526b030f642b4483f14fa47ac6bbed9b,7749939,"Passive investing now a core strategy for portfolio building: ICICI Pru expert Kolkata: The popularity of passive investments is rising at an astonishing pace. The AUM in Sept 2025 for passive mutual fund schemes be higher. Chintan Haria, principal, investment strategy ICICI Prudential AMC explains the reasons behind the popularity of passive",True,Brand mention includes a reputation-relevant BFSI context.,Brand Perception,Thought Leadership,Positive,0.68,"Matched taxonomy terms for Thought Leadership: expert, explains.",rule,"expert, explains",059c95e578174fdc
86,2025-11-27,Upstox,3 equity ETFs deliver 32% to 41% CAGR in 5 years: Key points to know,As many as three equity exchange-traded funds have each delivered an annualised compounded return of more than 30% in the five years ending,Government of India in 2017 and is currently managed by ICICI Prudential Mutual Fund. It invests in the constituents of the BSE Bharat 22,https://upstox.com/news/personal-finance/mutual-funds/3-equity-et-fs-deliver-32-to-41-cagr-in-5-years-key-points-to-know/article-185354/,6268740,3 equity ETFs deliver 32% to 41% CAGR in 5 years: Key points to know As many as three equity exchange-traded funds have each delivered an annualised compounded return of more than 30% in the five years ending Government of India in 2017 and is currently managed by ICICI Prudential Mutual Fund. It invests in the constituents of the BSE Bharat 22,True,Brand mention includes a reputation-relevant BFSI context.,User Experience,Product & Service Quality,Neutral,0.61,Matched taxonomy terms for Product & Service Quality: return.,rule,return,72ad1ef45dcb575b
87,2026-01-16,MSN India,"SIF in focus: ICICI Pru MF floats iSIF Equity Ex-Top 100 Long-Short Fund, iSIF Hybrid Long-Short Fund","SIF in focus: ICICI Pru MF floats iSIF Equity Ex-Top 100 Long-Short Fund, iSIF Hybrid Long-Short Fund ; ; ; ICICI Prudential Mutual Fund","the launches, Sankaran Naren, Executive Director and CIO at ICICI Prudential AMC, said the iSIF segment is meant to offer differentiated",https://www.msn.com/en-in/money/topstories/sif-in-focus-icici-pru-mf-floats-isif-equity-ex-top-100-long-short-fund-isif-hybrid-long-short-fund/ar-AA1UkZKB,656461,"SIF in focus: ICICI Pru MF floats iSIF Equity Ex-Top 100 Long-Short Fund, iSIF Hybrid Long-Short Fund SIF in focus: ICICI Pru MF floats iSIF Equity Ex-Top 100 Long-Short Fund, iSIF Hybrid Long-Short Fund ; ; ; ICICI Prudential Mutual Fund the launches, Sankaran Naren, Executive Director and CIO at ICICI Prudential AMC, said the iSIF segment is meant to offer differentiated",True,Brand mention includes a reputation-relevant BFSI context.,Brand Perception,Thought Leadership,Neutral,0.82,"Matched taxonomy terms for Thought Leadership: cio, sankaran naren, naren.",rule,"cio, sankaran naren, naren",f456a1aea7608b34
88,2025-11-19,MSN India,Which sectors could drive the next market rally? ICICI Prudential AMC's Rajat Chandak explains,; ; ; ; Assets under management (AUM) of flexi cap funds surged nearly 25% in the past 12 months to a record high of Rs 5.34 lakh crore in,"with Business Today, Rajat Chandak, Senior Fund Manager, ICICI Prudential AMC, shared his insights. Edited excerpts: BT: What’s",https://www.msn.com/en-in/money/topstories/which-sectors-could-drive-the-next-market-rally-icici-prudential-amc-s-rajat-chandak-explains/ar-AA1QJaGW,7749939,"Which sectors could drive the next market rally? ICICI Prudential AMC's Rajat Chandak explains ; ; ; ; Assets under management (AUM) of flexi cap funds surged nearly 25% in the past 12 months to a record high of Rs 5.34 lakh crore in with Business Today, Rajat Chandak, Senior Fund Manager, ICICI Prudential AMC, shared his insights. Edited excerpts: BT: What’s",True,Brand mention includes a reputation-relevant BFSI context.,Brand Perception,Thought Leadership,Positive,0.75,"Matched taxonomy terms for Thought Leadership: fund manager, explains.",rule,"fund manager, explains",e0984fa7a30be76f
89,2025-07-15,reddit.com/r/MutualfundsIndia,,,"Icici prudential multi asset fund This alone is sufficient to cover gold , bond ,.silver , stocks , real estate , etc",https://www.reddit.com/r/MutualfundsIndia/comments/1m0ejg4/comment/n392ycp,246890,"Icici prudential multi asset fund This alone is sufficient to cover gold , bond ,.silver , stocks , real estate , etc",True,Brand mention retained for reputation review.,User Experience,Product & Service Quality,Neutral,0.68,Matched taxonomy terms for Product & Service Quality: multi-asset.,rule,multi-asset,560870618b770ebf
90,2026-01-06,Business Today,Where are the best risk-reward opportunities for the next 12 months? Anand Shah of ICICI Prudential AMC explains,"Anand Shah, CIO - PMS & AIF Investments at ICICI Prudential AMC, shares his insights on portfolio positioning, sectors to favour or avoid,","with BT, Anand Shah, CIO - PMS & AIF Investments at ICICI Prudential AMC, shares his insights on how he is positioning portfolios,",https://www.businesstoday.in/mutual-funds/story/where-are-the-best-risk-reward-opportunities-for-the-next-12-months-anand-shah-of-icici-prudential-amc-explains-509597-2026-01-06,380254,"Where are the best risk-reward opportunities for the next 12 months? Anand Shah of ICICI Prudential AMC explains Anand Shah, CIO - PMS & AIF Investments at ICICI Prudential AMC, shares his insights on portfolio positioning, sectors to favour or avoid, with BT, Anand Shah, CIO - PMS & AIF Investments at ICICI Prudential AMC, shares his insights on how he is positioning portfolios,",True,Brand mention includes a reputation-relevant BFSI context.,Brand Perception,Thought Leadership,Neutral,0.68,"Matched taxonomy terms for Thought Leadership: cio, explains.",rule,"cio, explains",293b9b074a97bcfb
91,2025-11-22,Business Today,"Child funds compared: ICICI leads with 14%+ 5-year CAGR, SBI trails with 12%; what should you choose","Structured children’s mutual funds have emerged as powerful tools for long-term goal planning. Among them, SBI Magnum and ICICI Prudential",,https://www.businesstoday.in/mutual-funds/story/child-funds-compared-icici-childrens-fund-tops-charts-outshines-sbi-magnum-in-consistency-long-term-returns-503294-2025-11-22,,"Child funds compared: ICICI leads with 14%+ 5-year CAGR, SBI trails with 12%; what should you choose Structured children’s mutual funds have emerged as powerful tools for long-term goal planning. Among them, SBI Magnum and ICICI Prudential",True,Brand mention includes a reputation-relevant BFSI context.,User Experience,Product & Service Quality,Positive,0.68,Matched taxonomy terms for Product & Service Quality: long term.,rule,long term,47d4048eace2176b
