source_row_id,date,source_name,title,opening_text,hit_sentence,url,reach,clean_text,is_relevant,relevance_reason,reputation_driver,sub_driver,sentiment,classification_confidence,classification_reason,classification_source,matched_terms,dedupe_key
30,2026-01-01,CNBC-TV18,"From pharmaceuticals to software and healthcare, where S Naren sees opportunity now","ICICI Prudential AMC CIO S Naren said the market is in a mature bull phase, making stock picking more important than sector calls. He said",", across all styles. And that is what everyone in ICICI Prudential AMC is continuously working on. You picked up shares through",https://www.cnbctv18.com/market/stock-picking-sector-calls-key-in-mature-bull-market-icici-prudential-amc-s-naren-artificial-intelligence-it-sector-alpha-article-19811150.htm,245580,"From pharmaceuticals to software and healthcare, where S Naren sees opportunity now ICICI Prudential AMC CIO S Naren said the market is in a mature bull phase, making stock picking more important than sector calls. He said , across all styles. And that is what everyone in ICICI Prudential AMC is continuously working on. You picked up shares through",True,Brand mention includes a reputation-relevant BFSI context.,Brand Perception,Thought Leadership,Neutral,0.82,"Matched taxonomy terms for Thought Leadership: cio, s naren, naren.",rule,"cio, s naren, naren",3fc84c07e877005a
31,2025-07-03,The Financial Express,Best multi cap mutual funds to invest in 2025,This article breaks down the highest returning Multi Cap Mutual Funds through SIPs and why they matter in India’s current market,,https://www.financialexpress.com/money/best-multi-cap-mutual-funds-to-invest-in-2025-3901512/,8740784,Best multi cap mutual funds to invest in 2025 This article breaks down the highest returning Multi Cap Mutual Funds through SIPs and why they matter in India’s current market,True,Dataset-scoped app or service review retained based on BFSI experience signals.,Brand Perception,Product Strategy,Positive,0.46,No exact taxonomy phrase matched; assigned to Product Strategy from broad context rules.,rule,,1cc2f80223595dc3
32,2025-08-22,The Economic Times,35 equity mutual funds complete over 25 years in 2025. How much returns did they offer?,"As numerous new schemes emerge, 35 equity mutual funds in India have marked 25 years. These include ELSS, large and mid-cap, large-cap,",,https://economictimes.indiatimes.com/mf/analysis/35-equity-mutual-funds-complete-over-25-years-in-2025-how-much-returns-did-they-offer/articleshow/123449040.cms,12220656,"35 equity mutual funds complete over 25 years in 2025. How much returns did they offer? As numerous new schemes emerge, 35 equity mutual funds in India have marked 25 years. These include ELSS, large and mid-cap, large-cap,",True,Dataset-scoped app or service review retained based on BFSI experience signals.,User Experience,Product & Service Quality,Neutral,0.61,Matched taxonomy terms for Product & Service Quality: returns.,rule,returns,19bb441d2f6b400d
34,2026-01-19,Business Standard,Midcaps to Hybrids: Inside ICICI Prudential's new iSIF Long-Short funds,Don't miss the most important news and views of the day. Get them on our Telegram channel,"across market cycles,"" said Sankaran Naren, ED & CIO, ICICI Prudential AMC.",https://www.business-standard.com/finance/personal-finance/midcaps-to-hybrids-inside-icici-prudential-s-new-isif-long-short-funds-126011900516_1.html,30113088,"Midcaps to Hybrids: Inside ICICI Prudential's new iSIF Long-Short funds Don't miss the most important news and views of the day. Get them on our Telegram channel across market cycles,"" said Sankaran Naren, ED & CIO, ICICI Prudential AMC.",True,Brand mention includes a reputation-relevant BFSI context.,Brand Perception,Thought Leadership,Neutral,0.82,"Matched taxonomy terms for Thought Leadership: cio, sankaran naren, naren.",rule,"cio, sankaran naren, naren",4fe02be1a3a9973c
35,2025-08-17,reddit.com/r/mutualfunds,"Questions regarding ICICI Prudential Mutual Fund heads S. Naren statement !! Hello Folks, I recently came across this X post summarizing statements by S. Naren, the head of ICICI Prudential Mutual Fund. He mentioned that Indian markets are at insane valuations, and that a “lost decade” might come. During the “lost decade” from 1994 to 2004, returns were very weak despite the optimism of the time. Do we feel that there is another crash coming? What are your thoughts on this? I would be delighted if veteran investors could share their opinions. Thank you Here is the link https://x.com/TheClubJunto/status/1956422671027105937","have watched this interview. S Naren is a wise man who explains things in simple terms. Rather- listen to how he says it and what he says directly, instead of reading someone else's summary. Link of this interview: https://www.youtube.com/live/uF-6YaeKHJk Because I have read some of these summaries and none captured the essence. My learnings from this interview would be: Conventional wisdom says: Returns from equity will be lower in next decade than what we saw in last decade. Conventional wisdom may or may not turn out to be true. It is just more probable. As Naren says- Investing is not abt arithmatic, but abt probability. According to Naren- Large caps and Flexi caps are more attractive than Mid-Small caps. Hybrid funds which do Dynamic Asset Allocation, international funds investing in emerging markets are attractive. So- as an investor, good to not have very large allocations to mid and small caps. Good to diversify across market caps, assets and geographies. 29","nvesting in the Current Stock Market: Strategies from S. Naren (Head of ICICI Prudential Mutual Fund) Honesty is rare in Indian finance. S. Naren, who manages Rs. 6.5 lakh crore in equity, is an extraordinary mutual fund manager who is warning small investors to get cautious. S. Naren is a self-confessed fan of Charlie Munger. So, before we begin, here’s a short story Charlie Munger used to tell about fund managers: ""There was this guy who sold fishing rod sets. I asked him: ‘My God, they’re purple and green. Do fish really get attracted by these colors?’ And he said: ‘Mister, I don’t sell to fish.’ Fund managers remind me of that fishing rod salesman."" Priceless Guidance for Retail Investors from S. Naren’s Recent Interview on CNBC 1. Indian Stock Market Investors are the Sole Risk-Takers Financing the Entire Economy: Stock market investors today do not realize that instead of the banks, it is their hard-earned money which is now financing the companies. This “investor financing” is happening through over-valued IPOs, QIPs, MNCs Selling, and Promoter Exits. 2. Stocks are Trading at Insane Valuations: The problem with equity investing at present is that stocks are trading at 50 PE, 60 PE etc. in the hope that earnings growth will follow. But what happens if the earnings don’t come? During the “Lost Decade” from 1994 to 2004, many small and mid-cap companies disappeared. Growth and earnings did not come. Only large caps survived. Same risk applies to today’s over-valued market. 3. Judgment Day May Be Yet to Come: Private equity players who sell over-valued IPOs after cashing multi-bagger returns say “why worry – everyone is making money in India.” But the final time to judge the returns may not be today. 4. “Hold for the Long-Term” Mantra Only Works for Quality Stocks: With good stocks, time is your friend. With bad stocks, time is your enemy. At today’s valuations, even if you buy and hold for the long-term, capital destruction can happen – unless you buy high quality stocks. 5. Three Mistakes Investors Made in the 1990s Bull Market: As the bull market expanded: (a) They reduced the quality of their portfolios (by buying low quality stocks); (b) They reduced the liquidity of their portfolios (by buying illiquid stocks); and (c) They reduced the capitalization of their portfolios (by buying stocks with smaller market caps). Avoid these 3 mistakes – these are the lessons we learnt from the nineties. 6. India is the Only Market Where IPOs are Still Selling: Private equity investors say India is the only market where they can still sell their IPOs and get profitable exits. They have not made that kind of multi-bagger returns in any other market. 7. A Stock at 25 PE is Over-valued if There is No Earnings Growth: Most investors don’t understand what it means to buy a stock at 25 P/E with no earnings growth. It means you are paying the price for 25 years’ earnings. EXPLANATION: If a company has an EPS of Rs. 1 and its stock price is Rs. 25 (P/E = 25). So, you are paying Rs. 25 upfront for that stock. If the company continues to earn Rs. 1 per share every year (no growth in earnings), it will take 25 years (Rs. 1 x 25 years) to recover the initial stock investment of Rs. 25. Today there are so many companies whose quarterly results come and there is no earnings growth. So, even 20 or 25 P/E for such stocks is an over-valuation. 8. Will Indian Stock Valuations Always Remain High Because Only 6% Households Have Equity Participation and SIP Money Has a Long Runway? Naren: Flows alone cannot determine the valuations of an asset class in the long run. All the market gurus in history have said this. With the SIP inflows you might extend the over-valued market for another 2 or 3 years. But in the long run, only corporate earnings will determine valuations. Earnings growth is not happening right now in India. 9. Indian Stock Market in Next 2-3 Quarters: If consumption picks up in the festive season, and if credit growth improves (if people start taking fresh loans), then corporate earnings will come. But as of now, credit growth is low, and in this situation, earnings cannot come. 10. Strategy: Invest in Other Global Markets: Most global stock markets are cheaply valued and doing much better than India right now. Investors in India should consider investing in other global stock markets, which will likely deliver multi-year returns because of the low base. 11. Strategy: Diversify to Gold: Gold is no longer cheap, but for the sake of risk diversification, investors should consider investing partially in gold. No asset class is cheap in India right now (except perhaps office properties). 12: Strategy: No Interest in Crypto – Naren: “I’ve seen that whatever Charlie Munger said comes true with a time lag. He was against crypto investing. So, I’ve never considered it as an asset class for my investing.” 13. Strategy: Short-term Investing – Naren: ""In today’s market, even if we find we have a 10% or 20% potential upside in a stock, we buy. And then take a gain, and exit. If my target upside in a stock is 20%, and the stock price goes down by 5%, then my potential upside becomes 25%. So, we invest in those kinds of short-term opportunities. In that sense, volatility is my friend right now."" 14. Strategy: Oil & Gas Stocks like ONGC/BPCL etc. – Naren: “This is the only pocket where I feel the stock valuations in India may still be reasonable. The goal with low valuations is to limit your downside risk.” 15. Strategy: Pharma Stocks: Tariffs have created uncertainty, but pharma stocks are a multi-decadal story. The world population as well as India’s population is aging. With age, you need more medicines and more healthcare. Demand in this sector will only increase. 16. Strategy: Banking Stocks: Right now, banking growth is restricted because companies don’t need bank credit (as stock investors are financing them.) But whenever stock market correction happens, the banking sector will outperform because then good companies will have to take loans from the banks. 17. Strategy: Personal Investing: Naren is partially invested in his own mutual funds and partially invested in global stocks outside India. Percentage of India vs. Global allocation: Did not reveal. Endpiece: Charlie Munger said: “Fish where the fish are.” Right now extremely cheap valuations are available outside India. Look at global stocks with an open mind. If the mind is closed, it is dangerous to play the stock markets.",https://www.reddit.com/r/mutualfunds/comments/1mseu7v,21902499,"Questions regarding ICICI Prudential Mutual Fund heads S. Naren statement !! Hello Folks, I recently came across this X post summarizing statements by S. Naren, the head of ICICI Prudential Mutual Fund. He mentioned that Indian markets are at insane valuations, and that a “lost decade” might come. During the “lost decade” from 1994 to 2004, returns were very weak despite the optimism of the time. Do we feel that there is another crash coming? What are your thoughts on this? I would be delighted if veteran investors could share their opinions. Thank you Here is the link https://x.com/TheClubJunto/status/1956422671027105937 have watched this interview. S Naren is a wise man who explains things in simple terms. Rather- listen to how he says it and what he says directly, instead of reading someone else's summary. Link of this interview: https://www.youtube.com/live/uF-6YaeKHJk Because I have read some of these summaries and none captured the essence. My learnings from this interview would be: Conventional wisdom says: Returns from equity will be lower in next decade than what we saw in last decade. Conventional wisdom may or may not turn out to be true. It is just more probable. As Naren says- Investing is not abt arithmatic, but abt probability. According to Naren- Large caps and Flexi caps are more attractive than Mid-Small caps. Hybrid funds which do Dynamic Asset Allocation, international funds investing in emerging markets are attractive. So- as an investor, good to not have very large allocations to mid and small caps. Good to diversify across market caps, assets and geographies. 29 nvesting in the Current Stock Market: Strategies from S. Naren (Head of ICICI Prudential Mutual Fund) Honesty is rare in Indian finance. S. Naren, who manages Rs. 6.5 lakh crore in equity, is an extraordinary mutual fund manager who is warning small investors to get cautious. S. Naren is a self-confessed fan of Charlie Munger. So, before we begin, here’s a short story Charlie Munger used to tell about fund managers: ""There was this guy who sold fishing rod sets. I asked him: ‘My God, they’re purple and green. Do fish really get attracted by these colors?’ And he said: ‘Mister, I don’t sell to fish.’ Fund managers remind me of that fishing rod salesman."" Priceless Guidance for Retail Investors from S. Naren’s Recent Interview on CNBC 1. Indian Stock Market Investors are the Sole Risk-Takers Financing the Entire Economy: Stock market investors today do not realize that instead of the banks, it is their hard-earned money which is now financing the companies. This “investor financing” is happening through over-valued IPOs, QIPs, MNCs Selling, and Promoter Exits. 2. Stocks are Trading at Insane Valuations: The problem with equity investing at present is that stocks are trading at 50 PE, 60 PE etc. in the hope that earnings growth will follow. But what happens if the earnings don’t come? During the “Lost Decade” from 1994 to 2004, many small and mid-cap companies disappeared. Growth and earnings did not come. Only large caps survived. Same risk applies to today’s over-valued market. 3. Judgment Day May Be Yet to Come: Private equity players who sell over-valued IPOs after cashing multi-bagger returns say “why worry – everyone is making money in India.” But the final time to judge the returns may not be today. 4. “Hold for the Long-Term” Mantra Only Works for Quality Stocks: With good stocks, time is your friend. With bad stocks, time is your enemy. At today’s valuations, even if you buy and hold for the long-term, capital destruction can happen – unless you buy high quality stocks. 5. Three Mistakes Investors Made in the 1990s Bull Market: As the bull market expanded: (a) They reduced the quality of their portfolios (by buying low quality stocks); (b) They reduced the liquidity of their portfolios (by buying illiquid stocks); and (c) They reduced the capitalization of their portfolios (by buying stocks with smaller market caps). Avoid these 3 mistakes – these are the lessons we learnt from the nineties. 6. India is the Only Market Where IPOs are Still Selling: Private equity investors say India is the only market where they can still sell their IPOs and get profitable exits. They have not made that kind of multi-bagger returns in any other market. 7. A Stock at 25 PE is Over-valued if There is No Earnings Growth: Most investors don’t understand what it means to buy a stock at 25 P/E with no earnings growth. It means you are paying the price for 25 years’ earnings. EXPLANATION: If a company has an EPS of Rs. 1 and its stock price is Rs. 25 (P/E = 25). So, you are paying Rs. 25 upfront for that stock. If the company continues to earn Rs. 1 per share every year (no growth in earnings), it will take 25 years (Rs. 1 x 25 years) to recover the initial stock investment of Rs. 25. Today there are so many companies whose quarterly results come and there is no earnings growth. So, even 20 or 25 P/E for such stocks is an over-valuation. 8. Will Indian Stock Valuations Always Remain High Because Only 6% Households Have Equity Participation and SIP Money Has a Long Runway? Naren: Flows alone cannot determine the valuations of an asset class in the long run. All the market gurus in history have said this. With the SIP inflows you might extend the over-valued market for another 2 or 3 years. But in the long run, only corporate earnings will determine valuations. Earnings growth is not happening right now in India. 9. Indian Stock Market in Next 2-3 Quarters: If consumption picks up in the festive season, and if credit growth improves (if people start taking fresh loans), then corporate earnings will come. But as of now, credit growth is low, and in this situation, earnings cannot come. 10. Strategy: Invest in Other Global Markets: Most global stock markets are cheaply valued and doing much better than India right now. Investors in India should consider investing in other global stock markets, which will likely deliver multi-year returns because of the low base. 11. Strategy: Diversify to Gold: Gold is no longer cheap, but for the sake of risk diversification, investors should consider investing partially in gold. No asset class is cheap in India right now (except perhaps office properties). 12: Strategy: No Interest in Crypto – Naren: “I’ve seen that whatever Charlie Munger said comes true with a time lag. He was against crypto investing. So, I’ve never considered it as an asset class for my investing.” 13. Strategy: Short-term Investing – Naren: ""In today’s market, even if we find we have a 10% or 20% potential upside in a stock, we buy. And then take a gain, and exit. If my target upside in a stock is 20%, and the stock price goes down by 5%, then my potential upside becomes 25%. So, we invest in those kinds of short-term opportunities. In that sense, volatility is my friend right now."" 14. Strategy: Oil & Gas Stocks like ONGC/BPCL etc. – Naren: “This is the only pocket where I feel the stock valuations in India may still be reasonable. The goal with low valuations is to limit your downside risk.” 15. Strategy: Pharma Stocks: Tariffs have created uncertainty, but pharma stocks are a multi-decadal story. The world population as well as India’s population is aging. With age, you need more medicines and more healthcare. Demand in this sector will only increase. 16. Strategy: Banking Stocks: Right now, banking growth is restricted because companies don’t need bank credit (as stock investors are financing them.) But whenever stock market correction happens, the banking sector will outperform because then good companies will have to take loans from the banks. 17. Strategy: Personal Investing: Naren is partially invested in his own mutual funds and partially invested in global stocks outside India. Percentage of India vs. Global allocation: Did not reveal. Endpiece: Charlie Munger said: “Fish where the fish are.” Right now extremely cheap valuations are available outside India. Look at global stocks with an open mind. If the mind is closed, it is dangerous to play the stock markets.",True,Brand mention includes a reputation-relevant BFSI context.,Brand Perception,Thought Leadership,Neutral,0.95,"Matched taxonomy terms for Thought Leadership: fund manager, asset allocation, interview, explains, s naren.",rule,"fund manager, asset allocation, interview, explains, s naren, naren",a6cb5e310d6e8f8f
37,2025-11-24,LinkedIn,"ALT InvestorALT Investor 3,925 followers3,925 followers 2mo • Edited • 2 months ago • Edited • Visible to anyone on or off LinkedIn Follow We are back with another insightful podcast! This time, Ankur Jhaveri goes into a deep conversation with Manish Banthia, Chief Investment Officer of Fixed Income at ICICI Prudential AMC Ltd, on the intricacies of debt mutual funds and the importance of asset allocation. During the podcast, Manish emphasized the need for retail investors to understand economic cycles and make informed decisions about their portfolios. The discussion went on to cover the current state of hashtag#gold and hashtag#silver investments, the role of arbitrage funds, and the risks associated with fixed-income investments. Manish also provided valuable insights into how investors can navigate the market and optimize their returns.","We are back with another insightful podcast! This time, Ankur Jhaveri goes into a deep conversation with Manish Banthia , Chief Investment .","podcast! This time, Ankur Jhaveri goes into a deep conversation with Manish Banthia , Chief Investment Officer of Fixed Income at ICICI Prudential AMC Ltd , on the intricacies of debt mutual funds and the importance of asset allocation. During the podcast, Manish emphasized the",https://www.linkedin.com/feed/update/urn%3Ali%3Aactivity%3A7398610181351211009,,"ALT InvestorALT Investor 3,925 followers3,925 followers 2mo • Edited • 2 months ago • Edited • Visible to anyone on or off LinkedIn Follow We are back with another insightful podcast! This time, Ankur Jhaveri goes into a deep conversation with Manish Banthia, Chief Investment Officer of Fixed Income at ICICI Prudential AMC Ltd, on the intricacies of debt mutual funds and the importance of asset allocation. During the podcast, Manish emphasized the need for retail investors to understand economic cycles and make informed decisions about their portfolios. The discussion went on to cover the current state of hashtag#gold and hashtag#silver investments, the role of arbitrage funds, and the risks associated with fixed-income investments. Manish also provided valuable insights into how investors can navigate the market and optimize their returns. We are back with another insightful podcast! This time, Ankur Jhaveri goes into a deep conversation with Manish Banthia , Chief Investment . podcast! This time, Ankur Jhaveri goes into a deep conversation with Manish Banthia , Chief Investment Officer of Fixed Income at ICICI Prudential AMC Ltd , on the intricacies of debt mutual funds and the importance of asset allocation. During the podcast, Manish emphasized the",True,Brand mention includes a reputation-relevant BFSI context.,Brand Perception,Thought Leadership,Neutral,0.68,Matched taxonomy terms for Thought Leadership: asset allocation.,rule,asset allocation,82467d9faa3ba66b
38,2025-07-05,reddit.com/r/IndiaInvestments,I recently started my first job. And yes emergency fund and insurance are my priority. Currently I try to invest 30k monthly in the following MFs Parag Parikh Flexi Cap Fund Direct Growth - 10k Motilal Oswal Large Cap Fund Direct Growth - 5k ICICI Prudential Large Cap Fund Direct Growth - 5k Motilal Oswal Midcap Fund Direct Growth - 5k Edelweiss US Technology Equity FoF Direct Growth - 5k How is this fund allocation and how can I improve.,,,https://www.reddit.com/r/IndiaInvestments/comments/1lrh5au/comment/n1g6qcv,12772308,I recently started my first job. And yes emergency fund and insurance are my priority. Currently I try to invest 30k monthly in the following MFs Parag Parikh Flexi Cap Fund Direct Growth - 10k Motilal Oswal Large Cap Fund Direct Growth - 5k ICICI Prudential Large Cap Fund Direct Growth - 5k Motilal Oswal Midcap Fund Direct Growth - 5k Edelweiss US Technology Equity FoF Direct Growth - 5k How is this fund allocation and how can I improve.,True,Brand mention retained for reputation review.,Brand Perception,Product Strategy,Neutral,0.46,No exact taxonomy phrase matched; assigned to Product Strategy from broad context rules.,rule,,5c2a4dcfd87a069f
39,2026-01-01,The Financial Express,Demand recovery to shape growth outlook in new year,"With rural demand finally outpacing urban growth and private capex pivoting toward deep-tech like AI and semiconductors, India remains the","Other asset managers echoed this view. S Naren, ED and CIO, ICICI Prudential AMC, pointed out that policy measures such as tax cuts, GST",https://www.financialexpress.com/business/news/demand-recovery-to-shape-growth-outlook-in-new-year/4094013/,343822,"Demand recovery to shape growth outlook in new year With rural demand finally outpacing urban growth and private capex pivoting toward deep-tech like AI and semiconductors, India remains the Other asset managers echoed this view. S Naren, ED and CIO, ICICI Prudential AMC, pointed out that policy measures such as tax cuts, GST",True,Brand mention includes a reputation-relevant BFSI context.,Brand Perception,Thought Leadership,Positive,0.82,"Matched taxonomy terms for Thought Leadership: cio, s naren, naren.",rule,"cio, s naren, naren",4f55d877c98cb299
